{"schema_version":1,"role":"release_identity","release":{"version":"1.3.4","tag":"v1.3.4","candidate_commit_sha":"f03c78bab54efe1cd1596d51cf3f28193232e2a3"},"candidate_commit_sha":"f03c78bab54efe1cd1596d51cf3f28193232e2a3","tag_object_sha":"84b0a632af6f6fa96af5fb515cecbbe18dcf6d37","provenance":{"source_path":".planning/milestones/v2.13-phases/131-adoption-snapshot-phoenix-newcomer-proof/131-RELEASE-CANDIDATE.md","source_sha256":"6743a9f160cd15431759ba178e7ae1807745f87a859dbcbf90e1b3cb37416f88","source_commit":"81038c2a1f6388fc801dba3742456bb340df16f8","authority_note":"Git history, protected branches, and release tags remain authoritative; this capsule supplies bounded provenance and tamper evidence only."},"import":{"imported_at":"2026-08-26","reason":"preserved sealed v1.3.4 candidate, tag, and release provenance","redaction_class":"none"},"supersedes":[]}
